[
  {
    "competition_id": "fifa_world_cup",
    "season_id": "2026",
    "stage": "group",
    "group": "A",
    "rank": 1,
    "team_id": "czechia",
    "team_name": "Czechia",
    "played": 0,
    "won": 0,
    "drawn": 0,
    "lost": 0,
    "goals_for": 0,
    "goals_against": 0,
    "goal_difference": 0,
    "points": 0
  },
  {
    "competition_id": "fifa_world_cup",
    "season_id": "2026",
    "stage": "group",
    "group": "A",
    "rank": 2,
    "team_id": "korea-republic",
    "team_name": "Korea Republic",
    "played": 0,
    "won": 0,
    "drawn": 0,
    "lost": 0,
    "goals_for": 0,
    "goals_against": 0,
    "goal_difference": 0,
    "points": 0
  },
  {
    "competition_id": "fifa_world_cup",
    "season_id": "2026",
    "stage": "group",
    "group": "A",
    "rank": 3,
    "team_id": "mexico",
    "team_name": "Mexico",
    "played": 0,
    "won": 0,
    "drawn": 0,
    "lost": 0,
    "goals_for": 0,
    "goals_against": 0,
    "goal_difference": 0,
    "points": 0
  },
  {
    "competition_id": "fifa_world_cup",
    "season_id": "2026",
    "stage": "group",
    "group": "A",
    "rank": 4,
    "team_id": "south-africa",
    "team_name": "South Africa",
    "played": 0,
    "won": 0,
    "drawn": 0,
    "lost": 0,
    "goals_for": 0,
    "goals_against": 0,
    "goal_difference": 0,
    "points": 0
  },
  {
    "competition_id": "fifa_world_cup",
    "season_id": "2026",
    "stage": "group",
    "group": "B",
    "rank": 1,
    "team_id": "bosnia-and-herzegovina",
    "team_name": "Bosnia and Herzegovina",
    "played": 0,
    "won": 0,
    "drawn": 0,
    "lost": 0,
    "goals_for": 0,
    "goals_against": 0,
    "goal_difference": 0,
    "points": 0
  },
  {
    "competition_id": "fifa_world_cup",
    "season_id": "2026",
    "stage": "group",
    "group": "B",
    "rank": 2,
    "team_id": "canada",
    "team_name": "Canada",
    "played": 0,
    "won": 0,
    "drawn": 0,
    "lost": 0,
    "goals_for": 0,
    "goals_against": 0,
    "goal_difference": 0,
    "points": 0
  },
  {
    "competition_id": "fifa_world_cup",
    "season_id": "2026",
    "stage": "group",
    "group": "B",
    "rank": 3,
    "team_id": "qatar",
    "team_name": "Qatar",
    "played": 0,
    "won": 0,
    "drawn": 0,
    "lost": 0,
    "goals_for": 0,
    "goals_against": 0,
    "goal_difference": 0,
    "points": 0
  },
  {
    "competition_id": "fifa_world_cup",
    "season_id": "2026",
    "stage": "group",
    "group": "B",
    "rank": 4,
    "team_id": "switzerland",
    "team_name": "Switzerland",
    "played": 0,
    "won": 0,
    "drawn": 0,
    "lost": 0,
    "goals_for": 0,
    "goals_against": 0,
    "goal_difference": 0,
    "points": 0
  },
  {
    "competition_id": "fifa_world_cup",
    "season_id": "2026",
    "stage": "group",
    "group": "C",
    "rank": 1,
    "team_id": "brazil",
    "team_name": "Brazil",
    "played": 0,
    "won": 0,
    "drawn": 0,
    "lost": 0,
    "goals_for": 0,
    "goals_against": 0,
    "goal_difference": 0,
    "points": 0
  },
  {
    "competition_id": "fifa_world_cup",
    "season_id": "2026",
    "stage": "group",
    "group": "C",
    "rank": 2,
    "team_id": "haiti",
    "team_name": "Haiti",
    "played": 0,
    "won": 0,
    "drawn": 0,
    "lost": 0,
    "goals_for": 0,
    "goals_against": 0,
    "goal_difference": 0,
    "points": 0
  },
  {
    "competition_id": "fifa_world_cup",
    "season_id": "2026",
    "stage": "group",
    "group": "C",
    "rank": 3,
    "team_id": "morocco",
    "team_name": "Morocco",
    "played": 0,
    "won": 0,
    "drawn": 0,
    "lost": 0,
    "goals_for": 0,
    "goals_against": 0,
    "goal_difference": 0,
    "points": 0
  },
  {
    "competition_id": "fifa_world_cup",
    "season_id": "2026",
    "stage": "group",
    "group": "C",
    "rank": 4,
    "team_id": "scotland",
    "team_name": "Scotland",
    "played": 0,
    "won": 0,
    "drawn": 0,
    "lost": 0,
    "goals_for": 0,
    "goals_against": 0,
    "goal_difference": 0,
    "points": 0
  },
  {
    "competition_id": "fifa_world_cup",
    "season_id": "2026",
    "stage": "group",
    "group": "D",
    "rank": 1,
    "team_id": "australia",
    "team_name": "Australia",
    "played": 0,
    "won": 0,
    "drawn": 0,
    "lost": 0,
    "goals_for": 0,
    "goals_against": 0,
    "goal_difference": 0,
    "points": 0
  },
  {
    "competition_id": "fifa_world_cup",
    "season_id": "2026",
    "stage": "group",
    "group": "D",
    "rank": 2,
    "team_id": "paraguay",
    "team_name": "Paraguay",
    "played": 0,
    "won": 0,
    "drawn": 0,
    "lost": 0,
    "goals_for": 0,
    "goals_against": 0,
    "goal_difference": 0,
    "points": 0
  },
  {
    "competition_id": "fifa_world_cup",
    "season_id": "2026",
    "stage": "group",
    "group": "D",
    "rank": 3,
    "team_id": "turkiye",
    "team_name": "Turkiye",
    "played": 0,
    "won": 0,
    "drawn": 0,
    "lost": 0,
    "goals_for": 0,
    "goals_against": 0,
    "goal_difference": 0,
    "points": 0
  },
  {
    "competition_id": "fifa_world_cup",
    "season_id": "2026",
    "stage": "group",
    "group": "D",
    "rank": 4,
    "team_id": "united-states",
    "team_name": "United States",
    "played": 0,
    "won": 0,
    "drawn": 0,
    "lost": 0,
    "goals_for": 0,
    "goals_against": 0,
    "goal_difference": 0,
    "points": 0
  },
  {
    "competition_id": "fifa_world_cup",
    "season_id": "2026",
    "stage": "group",
    "group": "E",
    "rank": 1,
    "team_id": "cote-divoire",
    "team_name": "Cote d'Ivoire",
    "played": 0,
    "won": 0,
    "drawn": 0,
    "lost": 0,
    "goals_for": 0,
    "goals_against": 0,
    "goal_difference": 0,
    "points": 0
  },
  {
    "competition_id": "fifa_world_cup",
    "season_id": "2026",
    "stage": "group",
    "group": "E",
    "rank": 2,
    "team_id": "curacao",
    "team_name": "Curacao",
    "played": 0,
    "won": 0,
    "drawn": 0,
    "lost": 0,
    "goals_for": 0,
    "goals_against": 0,
    "goal_difference": 0,
    "points": 0
  },
  {
    "competition_id": "fifa_world_cup",
    "season_id": "2026",
    "stage": "group",
    "group": "E",
    "rank": 3,
    "team_id": "ecuador",
    "team_name": "Ecuador",
    "played": 0,
    "won": 0,
    "drawn": 0,
    "lost": 0,
    "goals_for": 0,
    "goals_against": 0,
    "goal_difference": 0,
    "points": 0
  },
  {
    "competition_id": "fifa_world_cup",
    "season_id": "2026",
    "stage": "group",
    "group": "E",
    "rank": 4,
    "team_id": "germany",
    "team_name": "Germany",
    "played": 0,
    "won": 0,
    "drawn": 0,
    "lost": 0,
    "goals_for": 0,
    "goals_against": 0,
    "goal_difference": 0,
    "points": 0
  },
  {
    "competition_id": "fifa_world_cup",
    "season_id": "2026",
    "stage": "group",
    "group": "F",
    "rank": 1,
    "team_id": "japan",
    "team_name": "Japan",
    "played": 0,
    "won": 0,
    "drawn": 0,
    "lost": 0,
    "goals_for": 0,
    "goals_against": 0,
    "goal_difference": 0,
    "points": 0
  },
  {
    "competition_id": "fifa_world_cup",
    "season_id": "2026",
    "stage": "group",
    "group": "F",
    "rank": 2,
    "team_id": "netherlands",
    "team_name": "Netherlands",
    "played": 0,
    "won": 0,
    "drawn": 0,
    "lost": 0,
    "goals_for": 0,
    "goals_against": 0,
    "goal_difference": 0,
    "points": 0
  },
  {
    "competition_id": "fifa_world_cup",
    "season_id": "2026",
    "stage": "group",
    "group": "F",
    "rank": 3,
    "team_id": "sweden",
    "team_name": "Sweden",
    "played": 0,
    "won": 0,
    "drawn": 0,
    "lost": 0,
    "goals_for": 0,
    "goals_against": 0,
    "goal_difference": 0,
    "points": 0
  },
  {
    "competition_id": "fifa_world_cup",
    "season_id": "2026",
    "stage": "group",
    "group": "F",
    "rank": 4,
    "team_id": "tunisia",
    "team_name": "Tunisia",
    "played": 0,
    "won": 0,
    "drawn": 0,
    "lost": 0,
    "goals_for": 0,
    "goals_against": 0,
    "goal_difference": 0,
    "points": 0
  },
  {
    "competition_id": "fifa_world_cup",
    "season_id": "2026",
    "stage": "group",
    "group": "G",
    "rank": 1,
    "team_id": "belgium",
    "team_name": "Belgium",
    "played": 0,
    "won": 0,
    "drawn": 0,
    "lost": 0,
    "goals_for": 0,
    "goals_against": 0,
    "goal_difference": 0,
    "points": 0
  },
  {
    "competition_id": "fifa_world_cup",
    "season_id": "2026",
    "stage": "group",
    "group": "G",
    "rank": 2,
    "team_id": "egypt",
    "team_name": "Egypt",
    "played": 0,
    "won": 0,
    "drawn": 0,
    "lost": 0,
    "goals_for": 0,
    "goals_against": 0,
    "goal_difference": 0,
    "points": 0
  },
  {
    "competition_id": "fifa_world_cup",
    "season_id": "2026",
    "stage": "group",
    "group": "G",
    "rank": 3,
    "team_id": "ir-iran",
    "team_name": "IR Iran",
    "played": 0,
    "won": 0,
    "drawn": 0,
    "lost": 0,
    "goals_for": 0,
    "goals_against": 0,
    "goal_difference": 0,
    "points": 0
  },
  {
    "competition_id": "fifa_world_cup",
    "season_id": "2026",
    "stage": "group",
    "group": "G",
    "rank": 4,
    "team_id": "new-zealand",
    "team_name": "New Zealand",
    "played": 0,
    "won": 0,
    "drawn": 0,
    "lost": 0,
    "goals_for": 0,
    "goals_against": 0,
    "goal_difference": 0,
    "points": 0
  },
  {
    "competition_id": "fifa_world_cup",
    "season_id": "2026",
    "stage": "group",
    "group": "H",
    "rank": 1,
    "team_id": "cabo-verde",
    "team_name": "Cabo Verde",
    "played": 0,
    "won": 0,
    "drawn": 0,
    "lost": 0,
    "goals_for": 0,
    "goals_against": 0,
    "goal_difference": 0,
    "points": 0
  },
  {
    "competition_id": "fifa_world_cup",
    "season_id": "2026",
    "stage": "group",
    "group": "H",
    "rank": 2,
    "team_id": "saudi-arabia",
    "team_name": "Saudi Arabia",
    "played": 0,
    "won": 0,
    "drawn": 0,
    "lost": 0,
    "goals_for": 0,
    "goals_against": 0,